{
  "schema_version": "gnczmkn.task-backlog/1",
  "current_gate": "R0",
  "updated_at": "2026-08-14",
  "status_values": ["planned", "ready", "in_progress", "blocked", "review", "done"],
  "tasks": [
    {
      "id": "B0-REP-001",
      "stage": "Bootstrap",
      "title": "Create the greenfield repository and CMake module skeleton",
      "status": "done",
      "priority": "P0",
      "size": "M",
      "owner_role": "architecture_lead",
      "assignee": "initial-preparation",
      "depends_on": [],
      "deliverables": ["C++17/CMake skeleton", "module dependency targets", "CLI and smoke tests"],
      "acceptance": ["Debug configure, build and CTest pass"],
      "evidence": ["Bootstrap CI or local validation report"],
      "architecture_refs": ["02 §13", "ADR-0002", "ADR-0003"]
    },
    {
      "id": "B0-DOC-001",
      "stage": "Bootstrap",
      "title": "Install handoff, ADR, task and gate governance",
      "status": "done",
      "priority": "P0",
      "size": "M",
      "owner_role": "architecture_lead",
      "assignee": "initial-preparation",
      "depends_on": [],
      "deliverables": ["Handoff guide", "ADR system", "machine-readable backlog", "gate templates"],
      "acceptance": ["A new member can find scope, current gate, work packages and review rules from README"],
      "evidence": ["Repository verification report"],
      "architecture_refs": ["README governance", "11", "roadmap governance"]
    },
    {
      "id": "B0-LEG-001",
      "stage": "Bootstrap",
      "title": "Freeze and package the legacy repository reference",
      "status": "done",
      "priority": "P0",
      "size": "M",
      "owner_role": "validation_lead",
      "assignee": "initial-preparation",
      "depends_on": [],
      "deliverables": ["Git archive", "SHA-256", "source manifest", "baseline test inventory"],
      "acceptance": ["Archive can be verified and extracted without entering the new build graph"],
      "evidence": ["reference/legacy manifest and checksum"],
      "architecture_refs": ["ADR-0001", "roadmap governance §1–§7"]
    },
    {
      "id": "B0-VER-001",
      "stage": "Bootstrap",
      "title": "Run and record the complete bootstrap verification",
      "status": "done",
      "priority": "P0",
      "size": "S",
      "owner_role": "validation_lead",
      "assignee": "initial-preparation",
      "depends_on": ["B0-REP-001", "B0-DOC-001", "B0-LEG-001"],
      "deliverables": ["B0 gate decision", "build/test/repository-check output"],
      "acceptance": ["All bootstrap checks pass and current_gate advances to R0"],
      "evidence": ["docs/quality/gate-decisions/B0-2026-08-09-passed.md"],
      "architecture_refs": ["docs/handoff/release-gates.md"]
    },

    {
      "id": "R0-GOV-001",
      "stage": "R0",
      "title": "Set owner-controlled delivery rules and supported toolchain",
      "status": "done",
      "priority": "P0",
      "size": "S",
      "owner_role": "product_owner",
      "assignee": null,
      "depends_on": ["B0-VER-001"],
      "deliverables": ["Lean repository instructions", "Owner-controlled role registry", "Supported platform/compiler ADR"],
      "acceptance": ["AI self-acceptance is disabled and the supported CI profiles build and test the repository"],
      "evidence": ["AGENTS.md, ADR-0010, role-assignments.json and CI workflow"],
      "architecture_refs": ["00 §2", "docs/handoff/team-operating-model.md"]
    },
    {
      "id": "R0-GOV-002",
      "stage": "R0",
      "title": "Decide repository, dependency and data licensing policy",
      "status": "planned",
      "priority": "P0",
      "size": "M",
      "owner_role": "product_owner",
      "assignee": null,
      "depends_on": ["B0-VER-001"],
      "deliverables": ["License ADR", "third-party and data provenance policy"],
      "acceptance": ["Internal and external sharing rules are explicit for code, assets and archives"],
      "evidence": ["Accepted ADR and provenance checklist"],
      "architecture_refs": ["03 §4", "05 package manifest", "08 lineage"]
    },
    {
      "id": "R0-ARCH-001",
      "stage": "R0",
      "title": "Freeze the terminology registry and architecture dependency map",
      "status": "done",
      "priority": "P0",
      "size": "L",
      "owner_role": "architecture_lead",
      "assignee": null,
      "depends_on": ["B0-VER-001"],
      "deliverables": ["Machine-readable terminology baseline", "module dependency map", "legacy-to-target ownership map"],
      "acceptance": ["Shared terms, enums, keys and owners each have one authority"],
      "evidence": ["Terminology conformance report"],
      "architecture_refs": ["reference-glossary", "02 §13", "01 §16"]
    },
    {
      "id": "R0-ARCH-002",
      "stage": "R0",
      "title": "Implement dependency, semantic and evolution guards",
      "status": "planned",
      "priority": "P0",
      "size": "L",
      "owner_role": "architecture_lead",
      "assignee": null,
      "depends_on": ["R0-ARCH-001", "R0-SPEC-001"],
      "deliverables": ["Automated architecture fitness functions", "CI integration"],
      "acceptance": ["Representative forbidden dependency, owner and legacy regressions fail CI"],
      "evidence": ["Positive and negative guard tests"],
      "architecture_refs": ["11 §13", "roadmap governance §9"]
    },
    {
      "id": "R0-LEG-001",
      "stage": "R0",
      "title": "Reproduce the legacy build, test suite and representative missions",
      "status": "review",
      "priority": "P0",
      "size": "M",
      "owner_role": "validation_lead",
      "assignee": null,
      "depends_on": ["B0-VER-001"],
      "deliverables": ["Legacy environment manifest", "test report", "representative run commands and outputs"],
      "acceptance": ["A clean extraction can reproduce the recorded results or document every environment gap"],
      "evidence": ["Build/test logs and artifact hashes"],
      "architecture_refs": ["01 §2", "roadmap governance §5"]
    },
    {
      "id": "R0-LEG-002",
      "stage": "R0",
      "title": "Extract preserved legacy runtime behavior oracles",
      "status": "planned",
      "priority": "P0",
      "size": "L",
      "owner_role": "validation_lead",
      "assignee": null,
      "depends_on": ["R0-LEG-001", "R0-SPEC-001"],
      "deliverables": ["Publish, phase, synchronous commit, continuous-group, CSV, stop and SimFlow oracle bundles"],
      "acceptance": ["Each oracle has input hash, expected facts, tolerance and preserve/fix/retire classification"],
      "evidence": ["Executable oracle suite"],
      "architecture_refs": ["00A §10", "11 §5.1"]
    },
    {
      "id": "R0-SCI-001",
      "stage": "R0",
      "title": "Freeze mathematical, unit, frame, time and quaternion conventions",
      "status": "review",
      "priority": "P0",
      "size": "L",
      "owner_role": "scientific_authority",
      "assignee": null,
      "depends_on": ["B0-VER-001"],
      "deliverables": ["Scientific convention ADRs", "property tests", "independent Python or MATLAB reference"],
      "acceptance": ["Direction, multiplication, serialization, SI and time conventions have executable checks"],
      "evidence": ["Property test and cross-tool report"],
      "architecture_refs": ["03 §6–§9", "03 §22"]
    },
    {
      "id": "R0-SCI-002",
      "stage": "R0",
      "title": "Create the minimal 3DoF scientific oracle bundle",
      "status": "planned",
      "priority": "P0",
      "size": "L",
      "owner_role": "model_sdk_lead",
      "assignee": null,
      "depends_on": ["R0-SCI-001", "R0-SPEC-001"],
      "deliverables": ["Initial conditions", "analytic or independent trajectory", "termination and convergence cases"],
      "acceptance": ["Reference runs are independent of legacy node count and CSV column order"],
      "evidence": ["ref-minimal-3dof bundle"],
      "architecture_refs": ["11 §5.3", "03 §22"]
    },
    {
      "id": "R0-SCI-003",
      "stage": "R0",
      "title": "Create the YYZ 6DoF scientific and behavior reference bundle",
      "status": "planned",
      "priority": "P0",
      "size": "XL",
      "owner_role": "scientific_authority",
      "assignee": null,
      "depends_on": ["R0-SCI-001", "R0-LEG-002", "R0-SPEC-001"],
      "deliverables": ["Mission and assets", "formula intermediate values", "trajectory and termination references", "tolerance report"],
      "acceptance": ["00A source, step, observation and diagnostic examples become machine-valid fixtures"],
      "evidence": ["REF-YYZ-001 executable bundle"],
      "architecture_refs": ["00A", "15 §2–§9", "15 §20"]
    },
    {
      "id": "R0-SCI-004",
      "stage": "R0",
      "title": "Create the CAVH formula and guidance reference bundle",
      "status": "planned",
      "priority": "P1",
      "size": "L",
      "owner_role": "scientific_authority",
      "assignee": null,
      "depends_on": ["R0-SCI-001", "R0-LEG-001", "R0-SPEC-001"],
      "deliverables": ["Paper citation and assumptions", "Eq17/Eq18 intermediate cases", "independent reference implementation"],
      "acceptance": ["Formula, derivative, envelope and TDCT checks isolate failures before closed-loop execution"],
      "evidence": ["CAVH formula bundle"],
      "architecture_refs": ["15 §10", "09 §16"]
    },
    {
      "id": "R0-SPEC-001",
      "stage": "R0",
      "title": "Define machine schemas for fixtures, oracles and PlanProofRecord",
      "status": "done",
      "priority": "P0",
      "size": "L",
      "owner_role": "architecture_lead",
      "assignee": null,
      "depends_on": ["B0-VER-001"],
      "deliverables": ["Versioned JSON schemas", "valid and invalid examples", "schema validation command"],
      "acceptance": ["R0 bundles fail early on missing identity, provenance, tolerance or expected facts"],
      "evidence": ["Schema conformance tests"],
      "architecture_refs": ["05 §10.6", "00A §3.4", "11 §5"]
    },
    {
      "id": "R0-PERF-001",
      "stage": "R0",